"Timestamp","Type","Title","URL","Description","Contributor Id","Image","Subsection"
"2025/05/25 13:50:00 AM GMT+1","🟣 Paper or Method","Connection Between Climatic Change and International Food Prices: Evidence from Robust Long-Range Cross-Correlation and Variable-Lag Transfer Entropy with Sliding Windows Approach","https://epjdatascience.springeropen.com/articles/10.1140/epjds/s13688-024-00482-1","This paper analyzes the impact of North Atlantic Oscillation (NAO) index fluctuations on global food prices using daily data (Jan 2020–May 2022). Applying advanced statistical methods, it finds significant short- and long-term correlations and causal links between NAO changes and major crop prices, highlighting NAO's predictive value for food security planning.","Mouad Elhamdi","/assets/images/thumb/Connection between climatic change and international food prices.jpg",""
"2025/05/25 16:24:00 AM GMT+1","🟣 Paper or Method","Scalable Spatiotemporal Prediction with Bayesian Neural Fields","https://www.nature.com/articles/s41467-024-51477-5","This paper presents Bayesian Neural Fields (BayesNF), a model that integrates deep neural networks with hierarchical Bayesian inference for large-scale spatiotemporal data. BayesNF offers accurate predictions with uncertainty quantification and outperforms existing methods in domains like climate and public health. It is implemented in JAX with GPU/TPU support.","Mouad Elhamdi","/assets/images/thumb/Bayesian neural fields.jpg",""
"2025/05/25 16:35:00 AM GMT+1","🟣 Paper or Method","A Bayesian Machine Learning Approach for Spatio-Temporal Prediction of COVID-19 Cases","https://link.springer.com/article/10.1007/s00477-021-02168-w#","This paper proposes a Bayesian neural network model for predicting COVID-19 cases across regions and time, incorporating mobility, spatial proximity, and temporal correlations. Tested on data from 245 zones in Castilla-Leon, Spain, it shows strong predictive performance and highlights the role of human movement and local transmission.","Mouad Elhamdi","/assets/images/thumb/Bayesian COVID19.jpg",""
"2025/05/25 16:42:00 AM GMT+1","🟣 Paper or Method","Comparison of Deep Neural Networks and Deep Hierarchical Models for Spatio-Temporal Data","https://link.springer.com/article/10.1007/s13253-019-00361-7","This paper compares hierarchical dynamic spatio-temporal models (H-DSTMs) and deep neural networks for modeling complex spatio-temporal processes. It discusses trade-offs between interpretability and scalability, and explores hybrid models that combine their strengths for high-dimensional, nonlinear data.","Mouad Elhamdi","/assets/images/thumb/DNNST.jpg",""
"2025/05/25 16:45:00 AM GMT+1","🟣 Paper or Method","Spatio-Temporal Statistics with R","https://spacetimewithr.org/","This book provides an accessible introduction to statistical analysis of spatio-temporal data, with hands-on applications of the statistical methods using R Labs found at the end of each chapter.","Mouad Elhamdi","/assets/images/thumb/STR.jpg",""
"2025/05/25 16:58:00 AM GMT+1","🟣 Paper or Method","Statistics for Spatio-Temporal Data","https://download.e-bookshelf.de/download/0004/0172/80/L-G-0004017280-0009119041.pdf","This book provides a comprehensive guide to modeling data across space and time using hierarchical statistical methods. It covers foundational concepts, exploratory techniques, and advanced spatio-temporal models, with practical applications in environmental science, climate studies, and public health.","Mouad Elhamdi","/assets/images/thumb/SST.jpg",""
"2025/05/25 17:20:00 PM GMT+1","🔴 Tutorial","PyMC Spatial GP","https://www.pymc-labs.com/blog-posts/spatial-gaussian-process-01/","This PyMC Labs tutorial shows how to model spatial data using Gaussian Processes in PyMC, covering spatial kernels, latent GPs, and posterior predictive checks, which are valuable for applications in geostatistics, epidemiology, and environmental modeling.","Mouad Elhamdi","/assets/images/thumb/PyMCSpatialGP.jpg",""
"2025/05/25 17:28:00 PM GMT+1","🟡 Tool","Tick Library","https://x-datainitiative.github.io/tick/","is a Python library for time-dependent modeling, featuring fast solvers for Hawkes processes, GLMs, and survival analysis. It supports simulation and inference, making it ideal for financial, criminological, and event-based data.","Mouad Elhamdi","/assets/images/thumb/Tick.jpg",""
"2025/05/25 17:34:00 PM GMT+1","🟡 Tool","STPP Simulator","https://github.com/meowoodie/Spatio-Temporal-Point-Process-Simulator","This GitHub project offers a framework for simulating spatio-temporal point processes, like Poisson and Hawkes models, over continuous space and time. It’s ideal for testing inference methods and exploring synthetic event dynamics.","Mouad Elhamdi","/assets/images/thumb/STPPSimulator.jpg",""
"2025/05/25 17:40:00 PM GMT+1","🟢 Dataset","MOSAICs: Machine Learning for Satellite Imagery","https://www.mosaiks.org/","MOSAICs provides preprocessed satellite imagery and feature embeddings designed for machine learning applications. It allows scalable learning with satellite data, especially for environmental, socio-economic, and infrastructure-related tasks across geographies.","Mouad Elhamdi","/assets/images/thumb/mosaiks.jpg","Contexts (Misc Data & APIs)"
"2025/05/25 17:48:00 PM GMT+1","🟢 Dataset","Awesome Spatial Datasets","https://www.spatialedge.co/p/awesome-datasets","This curated collection provides links to high-quality spatial datasets from urban planning, transportation, demography, and environmental monitoring. It’s a valuable resource for geospatial data scientists seeking open access datasets across domains.","Mouad Elhamdi","/assets/images/thumb/awesome_spatial.jpg","Contexts (Misc Data & APIs)"
"2025/05/25 17:50:00 PM GMT+1","🟢 Dataset","Gallup World Poll Public Datasets","https://www.gallup.com/analytics/318923/world-poll-public-datasets.aspx","Gallup World Poll offers cross-national survey data on public opinion, well-being, economics, and health. The public datasets support comparative research across more than 160 countries, making them valuable for global development and policy analysis.","Mouad Elhamdi","/assets/images/thumb/gallup_world_poll.jpg","Contexts (Misc Data & APIs)"
"2025/05/25 17:58:00 PM GMT+1","🟢 Dataset","CDC Foodborne Outbreak Data (BEAM)","https://www.cdc.gov/ncezid/dfwed/beam-dashboard.html","The CDC’s BEAM Dashboard provides curated data on foodborne disease outbreaks across the United States. It includes temporal and spatial details of outbreaks, pathogen types, and affected demographics, supporting public health and epidemiological research.","Mouad Elhamdi","/assets/images/thumb/cdc_beam.jpg","Contexts (Misc Data & APIs)"
"2025/05/25 15:55:00 PM GMT+1","🟢 Dataset","Meta on Humanitarian Data Exchange (HDX)","https://data.humdata.org/organization/meta","Meta’s HDX profile offers curated datasets that support humanitarian and development efforts globally. These datasets cover topics such as population movements, digital connectivity, and global crises, enabling data-driven decision-making in policy, health, and disaster response.","Mouad Elhamdi","/assets/images/thumb/meta_hdx.jpg","Contexts (Misc Data & APIs)"
"2025/05/25 23:45:00 PM GMT+1","🟢 Dataset","WorldPop Demographic Mapping","https://hub.worldpop.org/project/categories?id=14","WorldPop provides high-resolution, open-access population data to support research and policy in low- and middle-income countries. The datasets cover age structure, population density, health metrics, and urbanization trends, all mapped at fine spatial scales. This demographic data is vital for development planning, humanitarian response, and epidemiological modeling.","Mouad Elhamdi","/assets/images/thumb/worldpop.jpg",""
"2025/05/26 19:35:00 PM GMT+1","🟡 Tool","STPPGC","https://github.com/YahyaAalaila/STPPGC?tab=readme-ov-file","is a benchmarking toolkit for streaming STPP models. Its BenchSTPP framework supports end-to-end development with YAML configs, PyTorch Lightning, Ray Tune, and version-controlled logging for fast, reproducible prototyping and evaluation.","Mouad Elhamdi","/assets/images/thumb/stppgc.jpg",""
"2025/06/07 11:20:52 AM GMT+1","🟠 Website","The Spatial Edge","https://www.spatialedge.co/","The Spatial Edge is a weekly blog on geospatial data science and economics, featuring curated research, datasets, and commentary on topics like nightlights and spatial inequality. It includes practical tutorials for real-world applications.","Mouad Elhamdi","/assets/images/thumb/Spatialedge.jpg",
"2025/06/07 11:25:35 AM GMT+1","🟢 Dataset","Our World in Data","https://ourworldindata.org/","Our World in Data is an open-access data and research platform that explores the world’s largest problems through empirical evidence. It provides interactive charts, extensive datasets, and in-depth articles on topics such as global health, poverty, education, climate change, energy, and economic development.","Mouad Elhamdi","/assets/images/thumb/OurWorldinData.jpg","Contexts (Misc Data & APIs)"
"2025/06/07 11:30:12 AM GMT+1","🟡 Tool","Jeo","https://github.com/google-deepmind/jeo","is a foundation model framework by DeepMind for embedding geospatial and temporal data into a shared space. It supports tasks like land cover classification and change detection, enabling scalable, multimodal learning across sensors and regions for geospatial AI.","Mouad Elhamdi","/assets/images/thumb/WorkflowJeoGeeFlow.jpg",
"2025/06/07 11:35:41 AM GMT+1","🟡 Tool","GeeFlow","https://github.com/google-deepmind/geeflow","is a DeepMind library for generating large-scale Earth observation datasets using Google Earth Engine. It provides utilities and pipeline scripts to support geospatial AI research, especially for model training with frameworks like Jeo.","Mouad Elhamdi","/assets/images/thumb/WorkflowJeoGeeFlow.jpg",
"2025/06/07 11:40:55 AM GMT+1","🟡 Tool","Forest Typology","https://github.com/google-deepmind/forest_typology","is an AI initiative by DeepMind, WRI, and Google to map and classify global forest types. It estimates forest composition, identifies biodiversity hotspots and carbon sinks, and provides land cover layers and benchmark datasets for climate and conservation research.","Mouad Elhamdi","/assets/images/thumb/ForestTypology.jpg",
"2025/07/19 19:20:00 AM GMT+1","🔴 Tutorial","Intro to GIS with Python","https://github.com/giswqs/intro-gispro","This step‑by‑step tutorial introduces geospatial data analysis using Python and open‑source tools, covering GIS fundamentals, map visualization, and spatial operations.","Mouad Elhamdi","/assets/images/thumb/Intro to GIS with Python.jpg",""
"2025/07/19 19:25:12 AM GMT+1","🟡 Tool","OpenGeoAI","https://opengeoai.org/","OpenGeoAI is a platform offering open‑source geospatial AI tools and datasets for satellite imagery analysis, enabling research and applications in land use, disaster response, and sustainability.","Mouad Elhamdi","/assets/images/thumb/OpenGeoAI.jpg",""
"2025/07/19 19:30:45 GMT+1","🔵 Conference or Journal","Computers, Environment and Urban Systems","https://www.sciencedirect.com/journal/computers-environment-and-urban-systems","An interdisciplinary, peer‑reviewed Elsevier journal focusing on advanced computer‑based methods and analysis for urban and environmental systems (GIS, simulation, visualization, AI).","Mouad Elhamdi","/assets/images/thumb/Computers Environment and Urban Systems.jpg",""
"2025/07/19 20:00:10 GMT+1","🟡 Tool","MBG (Model‑Based Geostatistics)","https://cran.r-project.org/web/packages/mbg/index.html","An R package offering spatial machine learning and geostatistical modeling workflows that estimate continuous raster surfaces from point data and summarize uncertainty over regions.","Mouad Elhamdi","/assets/images/thumb/mbg.jpg",""
