"Timestamp","Type","Title","URL","Description","Contributor Id","Image"
"2025/02/03 10:56:45 PM GMT+1","🟠 Website","Uk Biobank","https://www.ukbiobank.ac.uk/","The UK Biobank is a large-scale biomedical database and research resource containing in-depth genetic and health information from half a million UK participants. Here are some of the key types of data they provide: Demographic Information: Basic details like age, sex, and ethnicity. Health and Medical Records: Data from hospital admissions, cancer registries, and death records. Questionnaire Data: Information on lifestyle factors such as diet, physical activity, mental health, and occupational history. Imaging Data: MRI scans of the brain, heart, and full body, as well as ultrasound scans of the carotid arteries. Biomarker Data: Blood tests, including biochemistry markers, blood count, infectious disease markers, and telomere length. Genetic Data: Whole genome sequencing, whole exome sequencing, and genome-wide genotyping. Activity Monitor Data: Physical activity data collected via wrist-worn monitors for a subset of participants. The UK Biobank provides a comprehensive resource for researchers to study the genetic and environmental factors influencing health and diseas","Abdelrahman Ezzeldin Nagib","/assets/images/thumb/default_image.jpg"
"2025/02/03 11:20:09 PM GMT+1","🟠 Website","Environmental Protection Agency(epa)","https://www.epa.gov/","The Environmental Protection Agency (EPA) provides a wealth of data related to environmental protection and public health. Here are some of the key types of data they offer: Air Quality Data: Information on air pollution levels, including data from stationary and mobile sources. Water Quality Data: Data on the quality of surface and groundwater, ensuring they are safe for drinking, fishing, and swimming. Chemical Data: Information on chemicals produced domestically and imported into the United States under the Toxic Substances Control Act. Geospatial Data: Environmental data organized by location to help users search for environmental issues affecting their local communities. Superfund Data: Information on contaminated sites and efforts to clean them up. Toxics Release Inventory: Data on the industrial management of toxic chemicals that may harm human health and the environment. The EPA also provides various tools and applications to interact with and analyze this data, such as AirNow, ECHO, and EJScreen","Abdelrahman Ezzeldin Nagib","/assets/images/thumb/default_image.jpg"
"2025/02/03 11:25:29 PM GMT+1","🟠 Website","Global Human Settlement Layer (ghsl)","https://human-settlement.emergency.copernicus.eu/","The Global Human Settlement Layer (GHSL) is a project by the European Commission's Joint Research Centre that provides open and free data and tools for assessing human presence on Earth. Here are some key aspects of the GHSL: Built-up Surface Data: Information on the share of land surface covered by roofed built-up structures, distinguishing between residential and non-residential uses. Population Data: Detailed spatial information on population distribution and density. Urbanization Data: Data on the degree of urbanization, including definitions and classifications of cities and urban areas. Geospatial Data: High-resolution satellite imagery and other Earth observation data used to analyze human settlements. Temporal Data: Data spanning from 1975 to 2030, with future predictions based on past trends. The GHSL data is organized into epochs (every 5 years) and is available for download in various resolutions and coordinate systems. The platform also offers visual analytics tools for exploring and visualizing the data","Abdelrahman Ezzeldin Nagib","/assets/images/thumb/default_image.jpg"
"2025/02/03 11:40:28 PM GMT+1","🟠 Website","Nasa open Data Portal","https://data.nasa.gov/browse?sortBy=newest&pageSize=20&page=1","he NASA Open Data Portal is a comprehensive resource that provides access to a vast array of publicly available NASA datasets. Here are some key aspects of the portal:Data Catalog: The portal hosts tens of thousands of datasets, covering various domains such as Earth science, atmospheric science, planetary science, and more. Metadata and Links: Most dataset pages on the portal contain metadata and links to the actual data, which may be hosted on other NASA archive sites. Visualization Tools: The portal offers data visualization tools to help users understand and explore the datasets. Open Innovation Program: The portal is part of NASA's open-innovation program, which also includes APIs and code repositories. Search Capabilities: Users can search for datasets using keywords, categories, and other filters. The portal aggregates data from different NASA archives and provides a centralized location for accessing and utilizing this data","Abdelrahman Ezzeldin Nagib","/assets/images/thumb/default_image.jpg"
"2025/02/03 11:45:11 PM GMT+1","🟠 Website","Food and Agriculture Organization of the United Nations","https://www.fao.org/faostat/en/#data","The Food and Agriculture Organization of the United Nations (FAO) provides a wealth of data related to food and agriculture. Here are some key types of data they offer: FAOSTAT: A comprehensive database providing free access to food and agriculture statistics for over 245 countries and territories from 1961 to the most recent year available. It covers various domains such as crop production, livestock, forestry, fisheries, and food security1. Sustainable Development Goals (SDG) Indicators: Data related to the 21 SDG indicators under FAO's custodianship, supporting countries in tracking progress towards achieving the SDGs. Agricultural Market Information System (AMIS): Market information on grains like wheat, maize, rice, and soybeans, enhancing food market transparency and policy response for food security. Food and Agriculture Microdata Catalogue (FAM): Access to micro datasets collected through farm and household surveys, containing information related to agriculture, food security, and nutrition. WaPOR: A remote sensing tool for monitoring and reporting on water productivity in agriculture, helping to improve water management. FishStat: Data on fisheries and aquaculture, providing information on fish production, trade, and consumption. Global Forest Resources Assessment (FRA): Data on the state of the world's forest resources, including forest area, biomass, and carbon stocks. The FAO also publishes various reports and yearbooks, such as the Statistical Yearbook World Food and Agriculture, which provides detailed statistics on economic dimensions, production, trade, prices, food security, and sustainability aspects of agriculture","Abdelrahman Ezzeldin Nagib","/assets/images/thumb/default_image.jpg"
"2025/02/03 11:51:12 PM GMT+1","🟠 Website","Google Health Covid-19 Open Data Repository","https://health.google.com/covid-19/open-data/raw-data","The Google Health COVID-19 Open Data Repository is a comprehensive collection of up-to-date COVID-19-related information. Here are some key aspects of the repository: Data Sources: The repository aggregates data from hundreds of sources, including governmental, health, university, news media, publications, and crowdsourcing. Data Types: It provides data on COVID-19 cases, deaths, vaccination rates, hospitalizations, and more. Visualization Tools: Users can explore and visualize the data using multi-layered graphs and charts. Download Options: The data can be downloaded in various formats, such as CSV and JSON, for analysis and integration into other systems. Customization: Users can customize their search with queries on weather, geography, and other variables. The repository aims to help public health professionals, researchers, policymakers, and others understand and manage the virus","Abdelrahman Ezzeldin Nagib","/assets/images/thumb/default_image.jpg"
"2025/02/03 11:59:55 PM GMT+1","🟡 Tool","open meteo","https://open-meteo.com/en/docs/historical-weather-api#start_date=2000-01-01&end_date=2009-12-31&hourly=temperature_2m,relative_humidity_2m,dew_point_2m,apparent_temperature,precipitation,rain,snowfall,snow_depth,weather_code,pressure_msl,surface_pressure,cloud_cover,cloud_cover_low,cloud_cover_mid,cloud_cover_high,et0_fao_evapotranspiration,vapour_pressure_deficit,wind_speed_10m,wind_speed_100m,wind_direction_10m,wind_direction_100m,wind_gusts_10m,soil_temperature_0_to_7cm,soil_temperature_7_to_28cm,soil_temperature_28_to_100cm,soil_temperature_100_to_255cm,soil_moisture_0_to_7cm,soil_moisture_7_to_28cm,soil_moisture_28_to_100cm,soil_moisture_100_to_255cm","The Open-Meteo platform provides a comprehensive Historical Weather API that offers access to a vast amount of meteorological data. Here are some key aspects of the data they provide: Temperature: Data on air temperature at 2 meters above ground level. Relative Humidity: Information on the amount of moisture in the air at 2 meters above ground level. Dew Point: The temperature at which air becomes saturated with moisture. Apparent Temperature: How hot or cold it feels to humans, considering humidity and wind speed. Precipitation: Data on total precipitation, including rain and snow. Rain and Snowfall: Specific measurements for rain and snow. Snow Depth: The depth of snow on the ground. Weather Code: Codes representing different weather conditions. Pressure: Atmospheric pressure at sea level and surface level. Cloud Cover: Information on total cloud cover and its distribution across low, mid, and high levels. Evapotranspiration: Reference evapotranspiration (ET₀) values. Vapour Pressure Deficit: The difference between the amount of moisture in the air and how much moisture the air can hold when it is saturated. Wind Speed: Wind speed measurements at 10 meters and 100 meters above ground level. Wind Direction: Direction of the wind at 10 meters and 100 meters above ground level. Wind Gusts: Maximum wind speed recorded over a short period. Soil Temperature: Temperature measurements at various soil depths (0-7 cm, 7-28 cm, 28-100 cm, 100-255 cm). Soil Moisture: Moisture content at various soil depths (0-7 cm, 7-28 cm, 28-100 cm, 100-255 cm). The API provides data from 2000 to 2009 and offers hourly updates for various weather variables. It's a valuable resource for researchers, developers, and anyone interested in historical weather data.","","/assets/images/thumb/default_image.jpg"
