"Timestamp","Type","Title","URL","Description","Contributor Id","Image","Subsection"
"2025/02/17 10:01:14 AM GMT+1","🟣 Paper or Method","Spatio-Temporal Point Process Statistics: A Review","https://surl.li/ofjlkm","This paper provides a review describing statistical models and methods for spatio-temporal data. They define characteristics and statistics to uniquely characterize certain spatio-temporal point processes.","Abdelrahman Ezzeldin Nagib","/assets/images/thumb/spatio_temporal_point_process_statistics_a_review.jpg","Reviews"
"2025/02/17 10:24:26 AM GMT+1","🟣 Paper or Method","A Review of Self-Exciting Spatio-Temporal Point Processes and Their Applications","https://surl.li/oekoqa","This paper reviews the theory, estimation, and inference of STPPs, emphasizing self-exciting models where events cluster around common causes. It also highlights key applications and future research directions.","Abdelrahman Ezzeldin Nagib","/assets/images/thumb/a_review-of_self_exciting_spatio_temporalpoint_processes_and_their_applications.jpg","Reviews"
"2025/02/17 10:59:26 AM GMT+1","🟣 Paper or Method","Statistical Deep Learning for Spatial and Spatiotemporal Data","https://surl.li/tkiigr","This paper provides a review of traditional and machine learning spatial and spatial-temporal data with a focus on a variety of hybrid models that integrate statistical models with deep learning models and gives an overview of computational technologies that have proven useful.","Abdelrahman Ezzeldin Nagib","/assets/images/thumb/statistical_deep_learning_for_spatial_and_spatiotemporal_data.jpg","Reviews"
"2025/02/17 12:30:30 PM GMT+1","🟣 Paper or Method","Spatio-Temporal Hawkes Point Processes: A Review","https://link.springer.com/article/10.1007/s13253-024-00653-7","This paper provides background on major aspects of Hawkes processes with a focus on simulation methods and estimation techniques among an overview of stochastic processes and the challenges of Hawkes processes.","Abdelrahman Ezzeldin Nagib","/assets/images/thumb/spatio_temporal_hawkes_point_processes_a_review.jpg","Reviews"
"2025/02/17 1:30:30 PM GMT+1","🟢 Dataset","Global Database of Events, Language, and Tone (GDELT)","https://www.gdeltproject.org/","GDELT provides world data with longitudes and latitudes and dates on events such as protests and violent attacks with context data such as people's emotions from the news. It has historical data dating to 1971 and efforts to further extend it further back to 1800. It gets updated every 15 minutes. Freely available.","Abdelrahman Ezzeldin Nagib","/assets/images/thumb/global_database_of_events_language_and_tone_(gdelt).jpg","Events"
"2025/02/17 11:40:30 PM GMT+1","🟢 Dataset","planet.com","https://www.planet.com/","Planet.com provides daily satellite earth data analytics with 200 satellites; they provide longitude, latitude, and dates and measurements for different planetary variables (soil water, land surface temperature, forest carbon), and it is updated daily. Payments required.","Abdelrahman Ezzeldin Nagib","/assets/images/thumb/planet_com.jpg","Contexts (Environment & Climate)"
"2025/02/16 12:30:01 AM GMT+1","🟢 Dataset","Google Maps Platform","https://mapsplatform.google.com/?utm_experiment=13102196","Google Maps Platform provides a context dataset for planet Earth (air quality, for example) with longitude and latitude and is regularly updated. Possible payments required.","Abdelrahman Ezzeldin Nagib","/assets/images/thumb/google_maps.jpg","Contexts (Environment & Climate)"
"2025/02/17 3:50:30 PM GMT+1","🟢 Dataset"," Here Maps","https://www.here.com/","Here Maps provides world data with longitudes and latitudes and dates for real-time traffic data, including flow, incidents, and congestion details. It gets updated regularly. Requires an API key and offers to get started for free, with usage-based pricing as needs grow.","Abdelrahman Ezzeldin Nagib","/assets/images/thumb/here_maps.jpg","Contexts (Misc Data & APIs)"
"2025/02/18 8:55:44 PM GMT+1","🟢 Dataset","Environmental Systems Research Institute (ESRI) Demographics","https://www.esri.com/en-us/arcgis/products/data/data-portfolio/demographics","Esri offers a vast collection of datasets from population count, income per capita, and more. It contains dates, longitude, and latitude, with dates going back 5 years and more. The date update frequency varies from 1 dataset to another. It requires a subscription or purchase.","Abdelrahman Ezzeldin Nagib","/assets/images/thumb/esri_demographics.jpg","Contexts (Population Data & Mobility)"
"2025/02/18 5:55:55 PM GMT+1","🟡 Tool","PyTorch Geometric Temporal","https://github.com/benedekrozemberczki/pytorch_geometric_temporal","This tool introduces various dynamic and temporal geometric deep learning, embedding, and spatio-temporal regression methods from a variety of published research papers.","Abdelrahman Ezzeldin Nagib","/assets/images/thumb/pytorch_geometric_temporal.jpg",""
"2025/02/18 6:30:30 PM GMT+1","🟡 Tool","Generative Neural Temporal Point Proces (GNTPP)","https://github.com/EDAPINENUT/GNTPP","This tool provides a PyTorch implementation of GNTPP from the paper Exploring Generative Neural Temporal Point Process. It focuses on deep generative models for producing high-quality event samples in temporal point process modeling.","Abdelrahman Ezzeldin Nagib","/assets/images/thumb/generative_neural_temporal_point_proces_(gntpp).jpg",""
"2025/02/18 6:55:19 PM GMT+1","🔴 Tutorial","Bayesian Modelling and Probabilistic Programming with Numpyro, and Deep Generative Surrogates for Epidemiology","https://elizavetasemenova.github.io/prob-epi/01_intro.html","This tutorial explores Bayesian modeling topics using NumPyro, covering inference, hierarchical models, spatial Gaussian processes, ODEs, and agent-based models for disease transmission.","Abdelrahman Ezzeldin Nagib","/assets/images/thumb/numpyro_figure.jpg",""
"2025/02/18 8:50:30 PM GMT+1","🟡 Tool","GIS OPS","https://gis-ops.com/de/","This tool provides routing information from sources like OpenStreetMap (OSM), TomTom, and HERE.","Abdelrahman Ezzeldin Nagib","/assets/images/thumb/GIS_OPS.jpg",""
"2025/02/23 7:55:55 PM GMT+1","🟢 Dataset","United Nations High Commissioner for Refugees (UNHCR)","https://www.unhcr.org/","UNHCR provides data for resettlement statistics, population statistics, and refugee statistics through their APIs.","Abdelrahman Ezzeldin Nagib","/assets/images/thumb/un_refugee.jpg","Contexts (Population Data & Mobility)"
"2025/02/23 8:35:59 PM GMT+1","🟢 Dataset","Beijing Traffic","https://github.com/deepkashiwa20/Urban_Concept_Drift/tree/main","This dataset contains traffic speeds at 5-minute granularity for 3126 roadway segments in Beijing between 2022/05/12 and 2022/07/25 and contains 3126 streets.","Abdelrahman Ezzeldin Nagib","/assets/images/thumb/beijing_traffic.jpg","Events"
"2025/02/23 8:45:30 PM GMT+1","🟢 Dataset","Beijing Air Quality","https://www.kaggle.com/datasets/sid321axn/beijing-multisite-airquality-data-set","This dataset contains the air quality in Beijing from 12 different country-level locations with dates from 2013 to 2017. It contains measurements for air quality such as CO₂ and O₃. The data was originally retrieved from the UCI Machine Learning Repository.","Abdelrahman Ezzeldin Nagib","/assets/images/thumb/beijing_air_pollution.jpg","Contexts (Environment & Climate)"
"2025/02/23 9:30:20 PM GMT+1","🟠 Website","NASA Moderate Resolution Imaging Spectroradiometer (MODIS)","https://modis.gsfc.nasa.gov/","MODIS provides various datasets such as land data, atmospheric data, ocean data, and thermal data. It also provides various tools, such as accessing analysis-ready data from land MODIS.","Abdelrahman Ezzeldin Nagib","/assets/images/thumb/modis.jpg",""
"2024/02/23 10:45:11 PM GMT+1","🔴 Tutorial","Sentinelsat Package","https://medium.com/@gabrielagodinho/querying-and-downloading-sentinel-satellite-data-with-python-80573e4b16f5","This tutorial explores the use of the Sentinelsat Python package for using different satellites for retrieving various forms of data, such as all weather data, land-surface temperature, and ocean color and land color with longitude and latitude locations.","Abdelrahman Ezzeldin Nagib","/assets/images/thumb/sentinelsat_package.jpg",""
"2025/02/24 0:30:30 AM GMT+1","🟣 Paper or Method","Behaviour-Based Dependency Networks Between Places Shape Urban Economic Resilience","https://www.nature.com/articles/s41562-024-02072-7","This paper shows how business closures during disruptions affect human mobility and neighboring businesses. Using data from five U.S. cities, it finds behavior-based relationships improve resilience predictions by approximately 40% over distance-based models, emphasizing the role of mobility in urban economic resilience.","Abdelrahman Ezzeldin Nagib","/assets/images/thumb/behaviour_based_dependency_networks.jpg","Spatio-Temporal Correlations."
"2025/02/24 0:45:10 AM GMT+1","🟠 Website","Atlas of Inequality","https://inequality.media.mit.edu/","The Atlas of Inequality maps income inequality across U.S. cities using aggregated anonymous location data to estimate visitors' incomes at places like cafes and stores. It measures how similar or different the incomes of visitors to each location are.","Abdelrahman Ezzeldin Nagib","/assets/images/thumb/atlas_of_inequality.jpg",""
"2025/02/24 4:50:30 PM GMT+1","🟣 Paper or Method","Child Marriage in Conflict Settings: A Geospatial Analysis","https://link.springer.com/article/10.1007/s43545-024-00940-7","This paper examines how conflict events influence child marriage, using georeferenced conflict data and microdata from over 2 million women across 56 countries. It estimates the impact of conflict occurrence and severity on child marriage rates around the year of marriage.","Abdelrahman Ezzeldin Nagib","/assets/images/thumb/child_marriage_paper.jpg","Spatio-Temporal Correlations"
"2025/02/24 5:50:30 PM GMT+1","🟣 Paper or Method","Toward Causal Inference for Spatio-Temporal Data: Conflict and Forest Loss in Colombia","https://www.tandfonline.com/doi/full/10.1080/01621459.2021.2013241#abstract","This paper discusses how armed conflict influences tropical forest loss. In this study, they propose a class of causal models for spatio-temporal stochastic processes, which allows one to formally define and quantify the causal effects.","Abdelrahman Ezzeldin Nagib","/assets/images/thumb/conflict_and_forest_loss in_colombia.jpg","Spatio-Temporal Correlations"
"2025/02/25 4:35:19 AM GMT+1","🔴 Tutorial","Learning with Temporal Point Processes","https://learning.mpi-sws.org/tpp-icml18/","This tutorial introduces the theory of temporal point processes, reviews key types, and explores their role in modern ML models and control algorithms. It also covers recent advances in deep learning and Bayesian nonparametrics.","Abdelrahman Ezzeldin Nagib","/assets/images/thumb/learning_with_temporal_point_processes.jpg",""
"2025/02/25 4:55:33 AM GMT+1","🟣 Paper or Method","Multi-Modality Spatio-Temporal Forecasting via Self-Supervised Learning","https://arxiv.org/pdf/2405.03255","This paper introduces MoSSL, a self-supervised learning framework for MoST data that captures latent temporal, spatial, and modality patterns while handling dynamic heterogeneity. Experiments on two real-world datasets show its superiority over state-of-the-art baselines.","Abdelrahman Ezzeldin Nagib","/assets/images/thumb/multi_modality_spatio_temporal forecasting.jpg","Spatio-Temporal Correlations"
"2025/02/25 5:15:33 AM GMT+1","🟣 Paper or Method","Spatio-Temporal Field Neural Networks for Air Quality Inference","https://arxiv.org/pdf/2403.02354","This paper highlights the limitation of graph neural networks and makes a first effort to combine two different spatiotemporal perspectives.","Abdelrahman Ezzeldin Nagib","/assets/images/thumb/spatio-remporal_field_neural_networks_for_air_quality.jpg","Spatio-Temporal Correlations"
"2025/02/25 6:15:33 PM GMT+1","🟣 Paper or Method","Worse Weather Amplifies Social Media Activity","https://journals.sagepub.com/doi/10.1177/09567976241306099","This  paper investigates how environmental factors affect online social activity using over 3.5 billion Facebook and X posts in the U.S. It finds that extreme temperatures and precipitation independently increase social media use, with compounded weather extremes amplifying the effect.","Abdelrahman Ezzeldin Nagib","/assets/images/thumb/weather_impact_on_social_medial.jpg","Spatio-Temporal Correlations"
"2025/02/26 8:15:30 AM GMT+1","🟣 Paper or Method","A Mathematical, Classical Stratification Modeling Approach to Disentangling the Impact of Weather on Infectious Diseases: A Case Study Using Spatio-Temporally Disaggregated Campylobacter Surveillance Data for England and Wales","https://journals.plos.org/ploscompbiol/article?id=10.1371/journal.pcbi.1011714","This paper introduces a conditional incidence method to assess weather's impact on infectious disease transmission, using campylobacteriosis as a case study. It finds a 5°C temperature rise (8°–15°C range) increases incidence by 1 case per million people.","Abdelrahman Ezzeldin Nagib","/assets/images/thumb/classical_stratification_for_disease_spreading.jpg","Spatio-Temporal Correlations"
"2025/02/26 8:40:30 AM GMT+1","🟣 Paper or Method","Comparative Evaluation of Point Process Forecasts","https://arxiv.org/pdf/2103.11884","This paper adapts consistent scoring functions and proper scoring rules for evaluating predictive performance in point processes. It presents a comparative study within this framework using a simulated earthquake forecast case study for Italy.","Abdelrahman Ezzeldin Nagib","/assets/images/thumb/comparative_eval_of_point_process_forecasts.jpg","Spatio-Temporal Correlations"
"2025/02/26 9:50:20 AM GMT+1","🟣 Paper or Method","Integration-free Training for Spatio-temporal Multimodal Covariate Deep Kernel Point Processes","https://openreview.net/pdf?id=Yvpenkym8A","This paper presents DKMPP, a deep STPP model that integrates multimodal covariates and uses scalable denoising score matching for efficient, integration-free training.","Abdelrahman Ezzeldin Nagib","/assets/images/thumb/DKMPP.jpg","Neural Methods"
"2025/02/26 11:15:20 AM GMT+1","🟣 Paper or Method","Deep Mixture Point Processes: Spatio-temporal Event Prediction with Rich Contextual Information","https://arxiv.org/pdf/1906.08952","This paper introduces DMPP (Deep Mixture Point Processes), a model for predicting spatio-temporal events using high-dimensional context from images and text. It models intensity as a kernel mixture with weights learned by a neural network to capture complex contextual effects.","Abdelrahman Ezzeldin Nagib","/assets/images/thumb/maya_okawa_multi_modal_model_paper.jpg","Neural Methods"
"2025/02/26 11:58:20 AM GMT+1","🟣 Paper or Method","Neural Point Process for Learning Spatiotemporal Event Dynamics","https://proceedings.mlr.press/v168/zhou22a/zhou22a.pdf","This paper introduces DeepSTPP, a deep dynamics model for forecasting irregular spatiotemporal events using a nonparametric space-time intensity function governed by a latent process. ","Abdelrahman Ezzeldin Nagib","/assets/images/thumb/DeepSTPP.jpg","Neural Methods"
"2025/03/10 3:30:10 PM GMT+1","🟣 Paper or Method","Goodness-Of-Fit Tests for Spatial Point Processes: A Review","https://arxiv.org/pdf/2501.03732v1","This paper reviews state-of-the-art goodness-of-fit tests for spatial point processes, covering classical functional summary statistics and recent methods from topological data analysis.","Abdelrahman Ezzeldin Nagib","/assets/images/thumb/goodness_of_fit_test_paper_500_500.jpg","Reviews"
"2025/03/14 1:45:30 PM GMT+2","🟢 Dataset","U.S. Water Quality Portal (WQP)","https://www.usgs.gov/media/images/water-quality-portal-new","A large repository integrating water quality monitoring data. The WQP provides access to millions of records on parameters like pH, dissolved oxygen, temperature, salinity, nutrients, and contaminant levels across the United States from 1950 to the present and is continually updated. Freely available.","Abdelrahman Ezzeldin Nagib","/assets/images/thumb/Water Quality Portal (WQP).jpg","Contexts (Environment & Climate)"
"2025/03/14 2:45:30 PM GMT+2","🟢 Dataset","European Environment Agency (EEA) Waterbase","https://surl.gd/usolve","The European Environment Agency’s Waterbase is an open database on the status and quality of Europe’s water. It contains data for rivers, lakes, groundwater, and coastal waters on metrics such as nutrients (nitrogen, phosphorus) across European monitoring stations. Freely available.","Abdelrahman Ezzeldin Nagib","/assets/images/thumb/EEA European Water Quality Portal (WQP).jpg","Contexts (Environment & Climate)"
"2025/03/14 3:50:30 PM GMT+2","🟢 Dataset","Mussel Watch","coastalscience.noaa.gov ","Mussel Watch is a biomonitoring program that tracks nearly 600 chemical contaminants, including heavy metals, chlorinated pesticides (like DDT), PAHs, and emerging contaminants. Data collected from 1986 to the present. Freely available.","Abdelrahman Ezzeldin Nagib","/assets/images/thumb/mussel.jpg","Contexts (Environment & Climate)"
"2025/04/14 9:30:00 AM GMT+1","🟢 Dataset","SatBird: Bird Species Distribution Modeling","https://neurips.cc/virtual/2023/poster/73571","SatBird is a dataset for modeling bird species distributions using satellite imagery and citizen science data (from eBird). It includes more than 2 million observations and multispectral data for 214 bird species across the U.S.","Mouad Elhamdi","/assets/images/thumb/satbird.jpg","Contexts (Environment & Climate)"
"2025/04/14 9:40:00 AM GMT+1","🟢 Dataset","Toxics Release Inventory (TRI)","https://catalog.data.gov/dataset/toxics-release-inventory-tri","The Toxics Release Inventory (TRI) tracks the management of certain toxic chemicals that may pose a threat to human health and the environment. It includes annual data reported by U.S. facilities since 1987.","Mouad Elhamdi","/assets/images/thumb/TRI.jpg","Contexts (Environment & Climate)"
"2025/04/14 9:50:00 AM GMT+1","🟢 Dataset","ECOTOX Knowledgebase","https://www.epa.gov/comptox-tools/ecotoxicology-ecotox-knowledgebase-resource-hub","The ECOTOX Knowledgebase provides single chemical environmental toxicity data for aquatic and terrestrial species. It includes data for over 12,000 chemicals and 13,000 species across hundreds of thousands of tests.","Mouad Elhamdi","/assets/images/thumb/ecotox.jpg","Contexts (Environment & Climate)"
"2025/04/14 10:00:00 AM GMT+1","🟢 Dataset","Information Platform for Chemical Monitoring (IPCheM)","https://ipchem.jrc.ec.europa.eu","IPCheM is the European Commission’s central access point for chemical monitoring data collected across Europe in air, water, soil, biota, and indoor environments. Supports chemical risk assessment and policy-making.","Mouad Elhamdi","/assets/images/thumb/ipchem.jpg","Contexts (Environment & Climate)"
"2025/04/14 10:10:00 AM GMT+1","🟢 Dataset","National Aquatic Resource Survey - Rivers and Streams","https://catalog.data.gov/dataset/national-aquatic-resource-survey-rivers-and-streams-data","This dataset from the U.S. EPA provides condition assessments of over 1,000 rivers and streams in the lower 48 U.S. states using biological, chemical, and physical indicators. Part of the National Aquatic Resource Surveys.","Mouad Elhamdi","/assets/images/thumb/nars.jpg","Contexts (Environment & Climate)"
"2025/04/14 10:20:00 AM GMT+1","🟢 Dataset","Germany Population Data (Zensus 2022)","https://atlas.zensus2022.de/","Population dataset from the German Federal Statistical Office (Destatis), based on the Zensus 2022. Offers detailed demographic distributions by region, gender, and age groups across Germany.","Mouad Elhamdi","/assets/images/thumb/germany-population.jpg","Contexts (Population Data & Mobility)"
"2025/04/14 10:30:00 AM GMT+1","🟢 Dataset","KidSat: Satellite Imagery for Childhood Poverty","https://arxiv.org/pdf/2407.05986","KidSat is a benchmark dataset for mapping childhood poverty using satellite imagery. It links high-resolution visual data with poverty labels across Africa and Latin America, enabling fair benchmarking for ML models.","Mouad Elhamdi","/assets/images/thumb/kidsat.jpg","Contexts (Misc Data & APIs)"
"2025/04/14 11:15:00 AM GMT+1","🟡 Tool","BSTPP: Bayesian Spatiotemporal Point Process","https://www.georgemohler.com/_files/ugd/9226cc_a9bc736f02bb41fa92f7021aac6fc0be.pdf","is a Python package for Bayesian inference on STPPs, supporting LGCP, Hawkes, and Cox-Hawkes models. It features a VAE for fast GP inference and an extendable module for custom or predefined trigger functions.","Mouad Elhamdi","/assets/images/thumb/spatial.jpg",""
"2025/04/14 11:20:00 AM GMT+1","🟡 Tool","GeoStats.jl","https://github.com/JuliaEarth/GeoStats.jl","is a Julia-based framework for geospatial data science and geostatistics, offering a unified interface for kriging, simulation, and estimation. It supports advanced geometry handling and high-performance spatial computations.","Mouad Elhamdi","/assets/images/thumb/GeoStats.jpg",""
"2025/04/14 11:30:00 AM GMT+1","🟡 Tool","mlr3spatiotempcv","https://www.jstatsoft.org/article/view/v111i07","is an R package extending mlr3 with spatiotemporal resampling strategies. It supports model evaluation, selection, and tuning for spatial data through a unified interface for advanced resampling techniques.","Mouad Elhamdi","/assets/images/thumb/spatial.jpg",""
"2025/04/14 11:50:00 AM GMT+1","🟣 Paper or Method","Agricultural Insecticides Threaten Surface Waters at the Global Scale","https://www.pnas.org/doi/10.1073/pnas.1500232112","This study reveals that agricultural insecticides are contaminating surface waters worldwide at levels that pose significant risks to aquatic biodiversity. The research highlights that current regulatory thresholds are often exceeded, leading to substantial declines in aquatic invertebrate populations.","Mouad Elhamdi","/assets/images/thumb/Agricultural insecticides.jpg",""
"2025/04/14 12:00:00 AM GMT+1","🟣 Paper or Method","Large Floods Drive Changes in Cause-Specific Mortality in the United States","https://www.nature.com/articles/s41591-024-03358-z","Analyzing 35.6 million U.S. death records from 2001 to 2018, this study finds that large floods are associated with increased mortality from cardiovascular and infectious diseases, as well as injuries. The research underscores the need for effective public health responses to flooding events.","Mouad Elhamdi","/assets/images/thumb/flood events.jpg",""
"2025/04/14 12:20:00 AM GMT+1","🟣 Paper or Method","Exposure to Heat and Student Cognitive Functioning","https://yabogv.github.io/research/heat_executive_function/","This paper examines the impact of heat exposure on student cognitive performance, revealing that higher temperatures negatively affect test scores, particularly among minority and low-income students. The findings suggest that climate change could exacerbate educational inequalities.","Mouad Elhamdi","/assets/images/thumb/Hot_classroom.jpg",""
"2025/04/14 12:30:00 AM GMT+1","🟣 Paper or Method","PriorVAE: Encoding Spatial Priors with VAEs for Small-Area Estimation","https://arxiv.org/pdf/2110.10422","PriorVAE introduces a novel approach to spatial modeling by using variational autoencoders to approximate Gaussian process priors. This method enables efficient Bayesian inference for small-area estimation tasks, reducing computational complexity while maintaining accuracy.","Mouad Elhamdi","/assets/images/thumb/prior vae.jpg",""
"2025/04/14 12:40:00 AM GMT+1","🟣 Paper or Method","Geographical Gaussian Process Regression: A Spatial Machine-Learning Model Based on Spatial Similarity","https://onlinelibrary.wiley.com/doi/10.1111/gean.12423","This paper presents a spatial machine-learning model that integrates geographical Gaussian process regression with spatial similarity measures. The approach enhances predictive performance in spatial data analysis by accounting for spatial dependencies and similarities.","Mouad Elhamdi","/assets/images/thumb/GPR.jpg",""
"2025/04/17 15:30:00 AM GMT+1","🟡 Tool","Spatstat","https://spatstat.org/","is a comprehensive R package for spatial point pattern analysis, offering tools for EDA, model fitting (Poisson, Cox, Gibbs), and simulation. It handles irregular windows and marked or inhomogeneous patterns, widely used in ecology, epidemiology, and environmental studies.","Mouad Elhamdi","/assets/images/thumb/Spatstat.jpg",""
"2025/04/28 13:00:00 AM GMT+1","🟣 Paper or Method","Causal Inference with Spatio-Temporal Data: Estimating the Effects of Airstrikes on Insurgent Violence in Iraq","https://academic.oup.com/jrsssb/article/84/5/1969/7072904?login=false","This paper introduces a framework for estimating causal effects in complex spatio-temporal settings, combining Bayesian nonparametrics with a potential outcomes approach. Applied to U.S. airstrikes in Iraq (2007–2008), it finds local reductions in violence but short-term spillover increases nearby, highlighting spatial dynamics of intervention impact.","Mouad Elhamdi","/assets/images/thumb/airstrike.jpg",""
"2025/05/12 12:15:00 PM GMT+1","🔵 Conference or Journal","GIScience","https://giscience2025.org/","The International Conference on Geographic Information Science (GIScience) is a top biennial event uniting global researchers to advance spatial analysis, geovisualization, GeoAI, and geosimulation. It features peer-reviewed papers, workshops, and posters, promoting interdisciplinary collaboration.","Mouad Elhamdi","/assets/images/thumb/spatial.jpg",""
